{
  "$schema": "https://json-schema.org/draft/2020-12/schema",
  "$id": "https://raw.githubusercontent.com/renezander030/agent-approval-gate/v3.2.0/schemas/approval-policy.schema.json",
  "title": "ApprovalPolicySnapshot",
  "description": "Immutable evidence of the policy revision and material inputs that selected an approval path.",
  "type": "object",
  "required": [
    "schema_version",
    "policy_id",
    "revision",
    "policy_digest",
    "evaluation_id",
    "material_input_hash",
    "evaluated_at",
    "requirements"
  ],
  "additionalProperties": false,
  "properties": {
    "schema_version": {"$ref": "common.schema.json#/$defs/schema_version"},
    "policy_id": {"$ref": "common.schema.json#/$defs/identifier"},
    "revision": {"type": "string", "minLength": 1, "maxLength": 128},
    "policy_digest": {"$ref": "common.schema.json#/$defs/digest"},
    "evaluation_id": {"$ref": "common.schema.json#/$defs/identifier"},
    "material_input_hash": {"$ref": "common.schema.json#/$defs/digest"},
    "evaluated_at": {"type": "string", "format": "date-time"},
    "outcome": {
      "description": "The evaluator's closed decision for this action. Record any other evaluator result, including a non-boolean, unknown, or errored result, as deny.",
      "type": "string",
      "enum": ["require_approval", "auto_approve", "deny"]
    },
    "outcome_reason": {"$ref": "common.schema.json#/$defs/safe_text", "maxLength": 500},
    "requirements": {
      "type": "object",
      "required": [
        "minimum_approvals",
        "distinct_approvers",
        "human_only",
        "allowed_channels",
        "allow_auto_approval",
        "separation_of_duties"
      ],
      "additionalProperties": false,
      "properties": {
        "minimum_approvals": {"type": "integer", "minimum": 1, "maximum": 16},
        "distinct_approvers": {"type": "boolean"},
        "human_only": {"type": "boolean"},
        "allowed_channels": {
          "type": "array",
          "minItems": 1,
          "uniqueItems": true,
          "items": {
            "type": "string",
            "enum": ["telegram", "slack", "email", "web", "n8n_form", "mcp_elicitation", "teams", "cli", "policy"]
          }
        },
        "signature_required_channels": {
          "type": "array",
          "uniqueItems": true,
          "items": {
            "type": "string",
            "enum": ["telegram", "slack", "email", "web", "n8n_form", "mcp_elicitation", "teams", "cli", "policy"]
          }
        },
        "allow_auto_approval": {"type": "boolean"},
        "human_required_effects": {
          "description": "Effects that require every approving decision to come from a human. destructive and open_world fire on a true hint; not_idempotent and not_read_only fire on a false hint. An undeclared hint takes its conservative value.",
          "type": "array",
          "uniqueItems": true,
          "items": {"type": "string", "enum": ["destructive", "open_world", "not_idempotent", "not_read_only"]}
        },
        "required_roles": {
          "type": "array",
          "uniqueItems": true,
          "items": {"type": "string", "minLength": 1, "maxLength": 64}
        },
        "separation_of_duties": {
          "type": "object",
          "required": [
            "requester_must_not_approve",
            "agent_must_not_approve",
            "distinct_signing_keys"
          ],
          "additionalProperties": false,
          "properties": {
            "requester_must_not_approve": {"type": "boolean"},
            "agent_must_not_approve": {"type": "boolean"},
            "distinct_signing_keys": {"type": "boolean"},
            "eligible_approver_ids": {
              "type": "array",
              "minItems": 1,
              "maxItems": 256,
              "uniqueItems": true,
              "items": {"$ref": "common.schema.json#/$defs/safe_text", "maxLength": 128}
            },
            "excluded_actor_ids": {
              "type": "array",
              "maxItems": 256,
              "uniqueItems": true,
              "items": {"$ref": "common.schema.json#/$defs/safe_text", "maxLength": 128}
            },
            "excluded_key_ids": {
              "type": "array",
              "maxItems": 256,
              "uniqueItems": true,
              "items": {"$ref": "common.schema.json#/$defs/safe_text", "maxLength": 128}
            }
          }
        }
      }
    }
  },
  "allOf": [
    {
      "if": {"properties": {"outcome": {"const": "auto_approve"}}, "required": ["outcome"]},
      "then": {
        "properties": {
          "requirements": {"properties": {"allow_auto_approval": {"const": true}}}
        }
      }
    }
  ]
}
