{
  "schema_version": "3.2.0",
  "policy_id": "policy.high-risk-email.v1",
  "revision": "2026-04-15.3",
  "policy_digest": "sha256:a4f5ac837738a43e70baa0f2d602bbba2f2285a518beb568746f310f0678dc35",
  "evaluation_id": "eval_2026-04-28_1c4f8a00",
  "material_input_hash": "sha256:2991d5f888b4369ae368a0e1effa0d4c9e74fe4ddf8c607ab96849aba0b28691",
  "evaluated_at": "2026-04-28T09:14:24Z",
  "outcome": "require_approval",
  "requirements": {
    "minimum_approvals": 1,
    "distinct_approvers": true,
    "human_only": true,
    "allowed_channels": [
      "email",
      "web"
    ],
    "signature_required_channels": [
      "email"
    ],
    "allow_auto_approval": false,
    "human_required_effects": [
      "destructive",
      "open_world"
    ],
    "required_roles": [
      "customer-support"
    ],
    "separation_of_duties": {
      "requester_must_not_approve": true,
      "agent_must_not_approve": true,
      "distinct_signing_keys": true,
      "eligible_approver_ids": [
        "rene@acme-corp.example"
      ],
      "excluded_actor_ids": [
        "approval-router",
        "agent.support-triage.prod"
      ],
      "excluded_key_ids": [
        "agent-fleet-shared-key"
      ]
    }
  }
}
